<?xml version="1.0" encoding="utf-8"?>
<!--
# MegaMek Data (C) 2025 by The MegaMek Team is licensed under CC BY-NC-SA 4.0.
# To view a copy of this license, visit https://creativecommons.org/licenses/by-nc-sa/4.0/
#
# NOTICE: The MegaMek organization is a non-profit group of volunteers
# creating free software for the BattleTech community.
#
# MechWarrior, BattleMech, `Mech and AeroTech are registered trademarks
# of The Topps Company, Inc. All Rights Reserved.
#
# Catalyst Game Labs and the Catalyst Game Labs logo are trademarks of
# InMediaRes Productions, LLC.
#
# MechWarrior Copyright Microsoft Corporation. MegaMek Data was created under
# Microsoft's "Game Content Usage Rules"
# <https://www.xbox.com/en-US/developers/rules> and it is not endorsed by or
# affiliated with Microsoft.
-->
<!-- Capellan Warrior House Orders use a different rank system, organize at the battalion
level rather than the regimental, and only have attached infantry and perhaps ASF. After
the CCAF reorganization that made augmented battalions standard, the warrior houses reorganized
into augmented battalions - one Mek heavy, one BA heavy. This implies that all infantry assets
had been upgraded to BA by that date. -->

<ruleset faction="CC.WHO" parent="CC" ratingSystem="IS" xmlns:xsi="http://www.w3.org/2001/XMLSchema-instance" xsi:noNamespaceSchemaLocation="formationRulesetSchema.xsd">

    <defaults>
        <unitType>Mek</unitType>
        <echelon>%BATTALION%</echelon>
        <rankSystem>%RANK_CC_WH%</rankSystem>
        <rating>C</rating>
    </defaults>

    <toc>
        <unitType>
            <option ifDateBetween="3081,">Mek,BattleArmor,Aero</option>
            <option ifDateBetween="3051,3080">Mek,Infantry,BattleArmor,Aero</option>
            <option>Mek,Infantry,Aero</option>
        </unitType>

        <echelon>
            <option ifDateBetween="3085," ifUnitType="Mek|BattleArmor">%BATTALION%^,%COMPANY%^,%LANCE%^</option>
            <option ifUnitType="Mek">%BATTALION%,%COMPANY%,%LANCE%</option>
            <option ifUnitType="Infantry">%BATTALION%,%COMPANY%</option>
            <option ifUnitType="BattleArmor">%BATTALION%,%COMPANY%,%PLATOON%</option>
            <option ifUnitType="AeroSpaceFighter">%WING%,%SQUADRON%^,%SQUADRON%,%FLIGHT%</option>
        </echelon>

        <rating>
            <option>A,B,C,D,F</option>
        </rating>
    </toc>

    <force echelon="%BATTALION%" eschName="Battalion" ifUnitType="Mek" ifAugmented="0">
        <name>{ordinal} Battalion</name>
        <co>%MAJOR%</co>

        <weightClass>
            <option weight="4">A</option>
            <option weight="9">H</option>
            <option weight="9">M</option>
            <option weight="7">L</option>
        </weightClass>

        <subforces>
            <subforceOption ifWeightClass="A">
                <option weightClass="A,A,A">%COMPANY%</option>
                <option weightClass="A,A,H">%COMPANY%</option>
                <option weightClass="A,H,H">%COMPANY%</option>
            </subforceOption>
            <subforceOption ifWeightClass="H">
                <option weightClass="A,H,H">%COMPANY%</option>
                <option weightClass="H,H,H">%COMPANY%</option>
                <option weightClass="H,H,M">%COMPANY%</option>
            </subforceOption>
            <subforceOption ifWeightClass="M">
                <option weightClass="H,M,M">%COMPANY%</option>
                <option weightClass="M,M,M">%COMPANY%</option>
                <option weightClass="M,M,L">%COMPANY%</option>
            </subforceOption>
            <subforceOption ifWeightClass="L">
                <option weightClass="M,M,L">%COMPANY%</option>
                <option weightClass="M,L,L">%COMPANY%</option>
                <option weightClass="L,L,L">%COMPANY%</option>
            </subforceOption>
        </subforces>

        <attachedForces ifUnitType="Mek">
            <subforce unitType="Infantry"
                      name="Infantry Support">%BATTALION%
            </subforce>
            <subforceOption>
                <option unitType="AeroSpaceFighter"
                        name="Aerospace Support">%FLIGHT%
                </option>
                <option weight="3" />
            </subforceOption>
        </attachedForces>
    </force>

    <force echelon="%BATTALION%" eschName="Battalion" ifUnitType="Infantry|BattleArmor" ifAugmented="0">
        <name>{ordinal} Battalion</name>
        <co>%MAJOR%</co>

        <unitType ifUnitType="Infantry" ifDateBetween="3051,"
                  ifRole="">
            <option weight="1">BattleArmor</option>
            <option weight="9" ifDateBetween="3051,3065">Infantry</option>
            <option weight="5" ifDateBetween="3066,3070">Infantry</option>
            <option weight="3" ifDateBetween="3071,3080">Infantry</option>
        </unitType>

        <weightClass>
            <option weight="1">A</option>
            <option weight="2">H</option>
            <option weight="4">M</option>
            <option weight="3">L</option>
        </weightClass>

        <ruleGroup>
            <motive ifUnitType="Infantry">
                <option weight="3">Jump</option>
                <option ifWeightClass="L" weight="3">Jump</option>
                <option weight="2">Tracked</option>
                <option weight="2">Wheeled</option>
                <option weight="1">Hover</option>
                <option ifWeightClass="L" weight="3">Hover</option>
                <option weight="16" />
            </motive>
        </ruleGroup>

        <subforces>
            <asParent />
        </subforces>
    </force>

    <force echelon="%COMPANY%" eschName="Company" ifUnitType="Infantry|BattleArmor" ifAugmented="0">
        <name ifRole="command">Command Company</name>
        <name>{alpha} Company</name>
        <co>%CAPTAIN%</co>

        <unitType ifUnitType="Infantry" ifDateBetween="3051,"
                  ifRole="" ifTopLevel="0">
            <option weight="1">BattleArmor</option>
            <option weight="9" ifDateBetween="3051,3060">Infantry</option>
            <option weight="7" ifDateBetween="3061,3065">Infantry</option>
            <option weight="5" ifDateBetween="3066,3070">Infantry</option>
            <option weight="3" ifDateBetween="3071,3075">Infantry</option>
            <option weight="1" ifDateBetween="3076,3080">Infantry</option>
        </unitType>

        <weightClass>
            <option weight="1">A</option>
            <option weight="2">H</option>
            <option weight="4">M</option>
            <option weight="3">L</option>
        </weightClass>

        <ruleGroup>
            <role ifUnitType="Infantry">
                <option weight="2">anti_mek</option>
                <option />
                <option ifWeightClass="H" weight="3" />
                <option ifWeightClass="M|L" weight="17" />
            </role>

            <variant ifWeightClass="H|A" ifUnitType="Infantry">
                <option weight="2">(Laser),(SRM)</option>
                <option />
            </variant>

            <motive ifWeightClass="L" ifUnitType="Infantry">
                <option weight="4">Jump</option>
                <option weight="2">Hover</option>
                <option weight="1">Wheeled</option>
                <option weight="1">Motorized</option>
            </motive>
        </ruleGroup>

        <subforces>
            <asParent />
        </subforces>
    </force>

    <force echelon="%BATTALION%" eschName="Augmented Battalion" ifAugmented="1">
        <name>{ordinal} Battalion (Augmented)</name>
        <co>%MAJOR%</co>

        <weightClass>
            <option weight="4">A</option>
            <option weight="9">H</option>
            <option weight="9">M</option>
            <option weight="7">L</option>
        </weightClass>

        <subforces>
            <subforceOption ifWeightClass="A">
                <option weightClass="A,A" weight="2"
                        augmented="1">%COMPANY%
                </option>
                <option weightClass="A,H" augmented="1">%COMPANY%</option>
            </subforceOption>
            <subforceOption ifWeightClass="H">
                <option weightClass="A,H" augmented="1">%COMPANY%</option>
                <option weightClass="H,H" weight="3"
                        augmented="1">%COMPANY%
                </option>
                <option weightClass="H,M" weight="2"
                        augmented="1">%COMPANY%
                </option>
            </subforceOption>
            <subforceOption ifWeightClass="M">
                <option weightClass="H,M" augmented="1">%COMPANY%</option>
                <option weightClass="M,M" weight="2"
                        augmented="1">%COMPANY%
                </option>
                <option weightClass="M,L" augmented="1">%COMPANY%</option>
            </subforceOption>
            <subforceOption ifWeightClass="L">
                <option weightClass="M,L" augmented="1">%COMPANY%</option>
                <option weightClass="L,L" weight="2"
                        augmented="1">%COMPANY%
                </option>
            </subforceOption>
        </subforces>

        <attachedForces ifUnitType="Mek">
            <subforce unitType="BattleArmor" augmented="1" name="Infantry Support">%BATTALION%</subforce>
            <subforceOption>
                <option unitType="AeroSpaceFighter"
                        name="Aerospace Support">%FLIGHT%
                </option>
                <option weight="3" />
            </subforceOption>
        </attachedForces>
    </force>

    <force echelon="%COMPANY%" eschName="Augmented Company" ifAugmented="1">
        <name ifRole="command">Command Company (Augmented)</name>
        <name>{alpha} Company (Augmented)</name>
        <co>%CAPTAIN%</co>

        <weightClass>
            <option weight="3">A</option>
            <option weight="8">H</option>
            <option weight="9">M</option>